id,category,question,answer,context,option_a,option_b,option_c,option_d,correct_letter,notes,difficulty,region_tag,volatility,last_verified,source
media-029,media,"Who directed ""Citizen Kane""?",Orson Welles (1941),"Released 1941. Welles was 25. Loosely based on William Randolph Hearst, who retaliated by banning mentions in his newspapers. Topped 'greatest films' critics' lists for decades.",John Ford,Billy Wilder,Orson Welles,Alfred Hitchcock,C,,2,global,stable,2026-04-23,
media-030,media,"Who directed ""Jaws""?",Steven Spielberg (1975),"Considered the first modern blockbuster. Famously over-budget and delayed because the mechanical shark kept breaking — Spielberg showed less of it as a result, which increased the suspense.",William Friedkin,George Lucas,Martin Scorsese,Steven Spielberg,D,,2,global,stable,2026-04-23,
media-031,media,"Who directed ""Inception""?",Christopher Nolan (2010),Original script; Nolan developed the idea for about 10 years. Hans Zimmer's 'BRAAAM' sound set a template for a decade of film trailers.,David Fincher,Ridley Scott,Darren Aronofsky,Christopher Nolan,D,,2,global,stable,2026-04-23,
media-032,media,"Who composed ""Messiah""?",George Frideric Handel (1741),Composed in about 3–4 weeks in 1741. Premiered in Dublin 1742. The tradition of audiences standing for the Hallelujah Chorus allegedly began when George II rose during a London performance.,George Frideric Handel,Wolfgang Amadeus Mozart,Johann Sebastian Bach,Joseph Haydn,A,,2,global,stable,2026-04-23,
media-033,media,Who composed the Brandenburg Concertos?,Johann Sebastian Bach,"A set of six concertos (1721) dedicated to the Margrave of Brandenburg, who seemingly never even had them performed. They sat in a Berlin library until the 19th century.",Antonio Vivaldi,Georg Philipp Telemann,Johann Sebastian Bach,George Frideric Handel,C,,2,global,stable,2026-04-23,
media-034,media,"Who composed ""La Traviata""?",Giuseppe Verdi,Premiered 1853 in Venice. Based on Dumas fils's 'La Dame aux Camélias'. One of the most-performed operas in the world.,Giuseppe Verdi,Giacomo Puccini,Gioachino Rossini,Gaetano Donizetti,A,,2,global,stable,2026-04-23,
media-035,media,Which musician won the 2016 Nobel Prize in Literature?,"Bob Dylan (for ""poetic expressions within the great American song tradition"")","First musician to win the Literature Nobel. The Academy reportedly had trouble contacting him to inform him. He initially didn't respond publicly, which prompted much commentary.",Bob Dylan,Leonard Cohen,Patti Smith,Paul Simon,A,,2,global,stable,2026-04-23,
media-036,media,"Michael Jackson's album ""Thriller"" was released in which year?",1982 (often cited as the best-selling album of all time),Released 30 November 1982. Best-selling album of all time — around 70 million copies. Jackson's collaboration with Quincy Jones. The 1983 'Thriller' music video redefined the form.,1983,1982,1980,1984,B,,2,global,stable,2026-04-23,
media-037,media,Which alter ego did David Bowie create in 1972?,Ziggy Stardust,Created for the album 'The Rise and Fall of Ziggy Stardust and the Spiders from Mars' (1972). Bowie retired Ziggy on stage at the Hammersmith Odeon in July 1973.,Ziggy Stardust,Aladdin Sane,The Thin White Duke,Halloween Jack,A,,2,global,stable,2026-04-23,
media-038,media,What is the nationality of ABBA?,Swedish,"Agnetha, Björn, Benny, Anni-Frid. Won Eurovision 1974 with 'Waterloo'. Reunited in 2021 for the album 'Voyage' — their first in 40 years.",Norwegian,Finnish,Danish,Swedish,D,,2,global,stable,2026-04-23,
media-039,media,"The musical ""Mamma Mia!"" is built around songs by which band?",ABBA,Premiered London 1999. Over 60 million tickets sold worldwide. The 2008 film starring Meryl Streep grossed about $614M.,Queen,The Beatles,ABBA,Elton John,C,,2,global,stable,2026-04-23,
media-040,media,Which two countries are tied with the most Eurovision Song Contest wins (7 each) as of 2024?,Ireland and Sweden,"Ireland won in 1970, 1980, 1987, 1992, 1993, 1994, 1996. Sweden won in 1974, 1984, 1991, 1999, 2012, 2015, 2023.",Ireland and Luxembourg,United Kingdom and Sweden,France and Sweden,Ireland and Sweden,D,,2,global,annual,2026-04-23,
media-041,media,Who was the voice of Darth Vader in the original Star Wars trilogy?,James Earl Jones,Voiced Vader but was uncredited in the original film. The on-screen body was played by David Prowse. Jones also voiced Mufasa in The Lion King.,Orson Welles,David Prowse,Morgan Freeman,James Earl Jones,D,,2,global,stable,2026-04-23,
media-042,media,What is the longest-running American animated primetime TV series?,The Simpsons (since 1989),"First aired 17 December 1989. 36+ seasons, 760+ episodes. Famous for seeming to have predicted a number of events, including a Trump presidency in a 2000 episode.",South Park,Family Guy,American Dad,The Simpsons,D,,2,global,stable,2026-04-23,
media-043,media,Which TV series had the most-watched finale in US history?,M*A*S*H (1983),28 February 1983. About 106 million US viewers — roughly 60% of the country. Held the single most-watched broadcast record for 25+ years.,Seinfeld,Cheers,M*A*S*H,Friends,C,,2,global,stable,2026-04-23,
media-044,media,What was Netflix's first in-house original scripted series?,House of Cards (2013),"February 2013. US remake of a 1990 BBC series. Released all 13 episodes at once, establishing the Netflix binge-release model. Lead actor Kevin Spacey was later written out after sexual-misconduct allegations.",Orange Is the New Black,Lilyhammer,Hemlock Grove,House of Cards,D,,2,global,stable,2026-04-23,
media-045,media,"Which Dutch director made ""RoboCop"" (1987) and ""Basic Instinct"" (1992) in Hollywood?",Paul Verhoeven,"Dutch. Also made 'Soldaat van Oranje' (1977), 'Black Book' (2006) and 'Elle' (2016). Known for combining violence, sexuality and political satire.",George Sluizer,Jan de Bont,Paul Verhoeven,Anton Corbijn,C,,2,netherlands,stable,2026-04-23,
media-046,media,"Who holds the record for most Best Actor Oscar wins, with three?",Daniel Day-Lewis,"Three Best Actor Oscars: 'My Left Foot' (1989), 'There Will Be Blood' (2007), 'Lincoln' (2012). Famous for extreme method preparation. Retired in 2017 before returning to the screen.",Marlon Brando,Jack Nicholson,Tom Hanks,Daniel Day-Lewis,D,,2,global,periodic,2026-04-23,
media-047,media,"Which Italian composer wrote ""The Barber of Seville""?",Gioachino Rossini,Premiered 1816 in Rome. Rossini composed it in under three weeks. Based on the first of Beaumarchais' Figaro plays — Mozart's 'Marriage of Figaro' is based on the second.,Giuseppe Verdi,Gaetano Donizetti,Giacomo Puccini,Gioachino Rossini,D,,2,global,stable,2026-04-23,
media-048,media,What is the highest-grossing film of all time (unadjusted for inflation) as of 2026?,"Avatar (2009), which retook the top spot from Avengers: Endgame after a 2022 re-release",Cameron's 2009 film; the 2022 re-release pushed it back ahead of Avengers: Endgame. Drove a 3D cinema boom that has since largely receded.,Avengers: Endgame (2019),Titanic (1997),Avatar (2009),Star Wars: The Force Awakens (2015),C,,2,global,current,2026-04-23,
media-049,media,Which instrument is Frédéric Chopin most associated with?,The piano,"Wrote almost exclusively for solo piano. Polish-French, 1810–49. Died at 39, most likely of tuberculosis.",The organ,The piano,The cello,The violin,B,,2,global,stable,2026-04-23,
media-050,media,"Who directed the 2026 Best Picture winner ""One Battle After Another""?",Paul Thomas Anderson (his first Oscar wins — also took Best Director and Best Adapted Screenplay),Anderson's 11th film. Swept the top categories. He had been nominated eight times previously without winning.,Wes Anderson,Paul Thomas Anderson,Denis Villeneuve,Yorgos Lanthimos,B,,2,global,stable,2026-04-23,
art-026,art,"Who painted ""The Last Supper""?","Leonardo da Vinci (1495–98, in Milan's Santa Maria delle Grazie)","Tempera and oil on dry plaster — Leonardo's experimental technique meant it began deteriorating almost immediately. Restored repeatedly, most recently from 1978–1999.",Leonardo da Vinci,Michelangelo,Caravaggio,Raphael,A,,2,global,stable,2026-04-23,
art-027,art,"Who painted ""The Starry Night""?","Vincent van Gogh (1889, from the asylum at Saint-Rémy)","Painted June 1889, a year before Van Gogh's death. From memory of the view from his asylum window at Saint-Paul-de-Mausole. Held at MoMA in New York.",Vincent van Gogh,Georges Seurat,Claude Monet,Paul Cézanne,A,,2,netherlands,stable,2026-04-23,
art-028,art,Of what nationality was the painter Frida Kahlo?,Mexican,"1907–1954. Contracted polio as a child; survived a horrific bus accident at 18 that left lifelong injuries. Of her ~143 paintings, the majority were self-portraits.",Argentine,Colombian,Brazilian,Mexican,D,,2,global,stable,2026-04-23,
art-029,art,"Who sculpted ""The Thinker""?",Auguste Rodin,Originally part of Rodin's 'The Gates of Hell' (commissioned 1880) depicting Dante. Later separated into a standalone work. Roughly 28 full-sized bronze casts exist worldwide.,Constantin Brâncuși,Michelangelo,Gian Lorenzo Bernini,Auguste Rodin,D,,2,global,stable,2026-04-23,
art-030,art,To which artistic tradition does Peter Paul Rubens belong?,Flemish Baroque,"1577–1640. Prolific — around 1,400 works, produced in a large workshop. Known for voluptuous nudes (hence 'Rubensian' as an adjective).",French Baroque,Dutch Golden Age,Italian Baroque,Flemish Baroque,D,,2,global,stable,2026-04-23,
art-031,art,Which pop artist is famous for his Campbell's Soup Cans?,Andy Warhol,"1962 series of 32 canvases, one for each Campbell's variety. Pioneered the idea that advertising imagery could be fine art. Warhol's 'Factory' studio was a cultural hub in 1960s New York.",Andy Warhol,Jasper Johns,Roy Lichtenstein,Claes Oldenburg,A,,2,global,stable,2026-04-23,
art-032,art,Which American painter is famous for his drip/action painting technique?,Jackson Pollock,1912–1956. Developed 'drip' painting around 1947 at his Long Island studio. Died in a car crash at 44. Central figure in Abstract Expressionism.,Franz Kline,Mark Rothko,Willem de Kooning,Jackson Pollock,D,,2,global,stable,2026-04-23,
art-033,art,What is the pseudonymous name of the anonymous British street artist known for politically charged stencil work?,Banksy,"Identity officially unconfirmed; most likely Robin Gunningham, born Bristol around 1973. 'Girl with Balloon' famously self-destructed halfway through shredding at Sotheby's in 2018 — and then sold for even more.",Shepard Fairey,Jean-Michel Basquiat,Banksy,Keith Haring,C,,2,global,stable,2026-04-23,
art-034,art,Who designed the Guggenheim Museum in Bilbao (opened 1997)?,Frank Gehry,Opened 1997. Deconstructivist titanium-clad design revitalised the city — the 'Bilbao effect' is now a term in urban planning. Gehry is Canadian-American.,Frank Gehry,Norman Foster,Zaha Hadid,Santiago Calatrava,A,,2,global,stable,2026-04-23,
art-035,art,The Eiffel Tower was built as the entrance arch for which 1889 event?,"The Exposition Universelle (Paris World's Fair), marking the centenary of the French Revolution",Built by Gustave Eiffel's company for the centenary of the Revolution. Originally intended to be dismantled after 20 years; kept because it proved useful as a radio antenna.,The Bastille Day centenary celebration,The 1900 Paris Exposition,The Exposition Universelle (1889 Paris),The 1855 Paris World's Fair,C,,2,global,stable,2026-04-23,
art-036,art,"Who painted the Ghent Altarpiece (also known as ""The Adoration of the Mystic Lamb"")?","Jan van Eyck (completed 1432), with work begun by his brother Hubert",Completed 1432. 12-panel polyptych in Ghent's St Bavo Cathedral. Often cited as the most-stolen artwork of all time (13 separate thefts). The 'Just Judges' panel stolen in 1934 has never been recovered.,Rogier van der Weyden,Hugo van der Goes,Hans Memling,Jan van Eyck,D,,2,netherlands,stable,2026-04-23,
art-037,art,"Which Belgian surrealist is famous for paintings of men in bowler hats, pipes, and apples?",René Magritte,"1898–1967. Most famous works: 'The Son of Man' (bowler hat with floating apple), 'The Treachery of Images' ('Ceci n'est pas une pipe'), and 'The Lovers' (the cloth-shrouded kiss).",Hergé,James Ensor,Paul Delvaux,René Magritte,D,,2,global,stable,2026-04-23,
art-038,art,In which city is the Hermitage Museum?,"Saint Petersburg, Russia",Founded in 1764 by Catherine the Great. One of the largest museums in the world — around 3 million items. The main building is the Winter Palace.,Saint Petersburg,Moscow,Prague,Kyiv,A,,2,global,stable,2026-04-23,
art-039,art,In which city is the Uffizi Gallery?,"Florence, Italy","Originally a Medici office building — 'uffizi' means 'offices'. Houses Botticelli's 'Birth of Venus' and 'Primavera', da Vinci's 'Annunciation' and much more.",Milan,Venice,Florence,Rome,C,,2,global,stable,2026-04-23,
art-040,art,In which city is Notre-Dame Cathedral located?,Paris (Île de la Cité),Built 1163–1345. Badly damaged by fire on 15 April 2019. Reopened in December 2024 after a restoration costing over €700M.,Rouen,Paris,Chartres,Reims,B,,2,global,stable,2026-04-23,
art-041,art,In which city is the Colosseum?,Rome,"Completed 80 CE. Could hold an estimated 50,000–80,000 spectators. Hosted gladiatorial combat, staged hunts and occasional mock naval battles with a flooded arena.",Verona,Pompeii,Athens,Rome,D,,2,global,stable,2026-04-23,
art-042,art,In which city is the Parthenon?,Athens (on the Acropolis),Built 447–432 BCE under Pericles. Dedicated to Athena Parthenos. Badly damaged in 1687 when Venetian bombardment hit an Ottoman powder magazine stored inside it.,Olympia,Athens,Delphi,Corinth,B,,2,global,stable,2026-04-23,
art-043,art,"Which Japanese artist made ""The Great Wave off Kanagawa""?",Katsushika Hokusai (c. 1831),"Woodblock print, part of 'Thirty-six Views of Mount Fuji'. Hokusai was around 70 when he made it. Heavily influenced European Impressionism via the Japonisme movement.",Katsushika Hokusai,Tōshūsai Sharaku,Kitagawa Utamaro,Utagawa Hiroshige,A,,2,global,stable,2026-04-23,
art-044,art,"Who painted ""The Kiss"" (1907–08), with its gold-leaf embrace?",Gustav Klimt,1907–08. Part of Klimt's 'Golden Period' — actual gold leaf used. Held at the Österreichische Galerie Belvedere in Vienna.,Gustav Klimt,Koloman Moser,Egon Schiele,Oskar Kokoschka,A,,2,global,stable,2026-04-23,
art-045,art,Frida Kahlo's husband was a famous Mexican muralist — who was he?,Diego Rivera,1886–1957. Married Kahlo in 1929; they divorced in 1939 and remarried in 1940. His massive public murals celebrated Mexican workers and pre-Columbian heritage. A committed Marxist — he once sheltered Trotsky.,Rufino Tamayo,José Clemente Orozco,David Alfaro Siqueiros,Diego Rivera,D,,2,global,stable,2026-04-23,
art-046,art,What was the nationality of the architect Le Corbusier?,"Swiss-French (born in Switzerland, naturalized French)","Born Charles-Édouard Jeanneret-Gris in La Chaux-de-Fonds, Switzerland, 1887. Later naturalised French. Influential but controversial — pioneered brutalist/modernist urban planning (Ville Radieuse), often criticised for its anti-human scale.",German,French,Swiss-French,Swiss,C,,2,global,stable,2026-04-23,
art-047,art,"In which Madrid museum is Picasso's ""Guernica"" displayed?",The Museo Reina Sofía,"Guernica arrived at the Reina Sofía from MoMA in 1981 per Picasso's wishes, which required Franco's death. The museum also houses major works by Dalí and Miró.",The Museo Reina Sofía,The Prado,The Thyssen-Bornemisza,CaixaForum Madrid,A,,2,global,stable,2026-04-23,
art-048,art,"Which Dutch/Flemish painter is famous for peasant scenes and ""The Tower of Babel""?",Pieter Bruegel the Elder,"Around 1525–1569. Father of a Flemish painting dynasty (Pieter the Younger, Jan the Elder). 'The Tower of Babel' (1563) and 'Hunters in the Snow' (1565) are among his best-known works.",Jan van Eyck,Pieter Bruegel the Elder,Hieronymus Bosch,Hans Memling,B,,2,netherlands,stable,2026-04-23,
art-049,art,"Which Dutch architect designed the Rietveld Schröder House (1924), a De Stijl landmark in Utrecht?",Gerrit Rietveld,1888–1964. Trained as a cabinetmaker. His Red and Blue Chair (1917) is a De Stijl design classic. The Rietveld Schröder House is now a UNESCO World Heritage Site.,H.P. Berlage,Jaap Bakema,Willem Marinus Dudok,Gerrit Rietveld,D,,2,netherlands,stable,2026-04-23,
art-050,art,Who designed the glass pyramid at the Louvre (completed 1989)?,I.M. Pei,Commissioned by President Mitterrand. Met with fierce opposition initially — now beloved. Pei was Chinese-American; also designed the Bank of China Tower in Hong Kong and the National Gallery East Wing in Washington DC.,Renzo Piano,I.M. Pei,Norman Foster,Philippe Starck,B,,2,global,stable,2026-04-23,
sports-026,sports,Which country did Lionel Messi captain to victory at the 2022 FIFA World Cup?,Argentina (defeating France on penalties),"Beat France 3–3 (4–2 on penalties) in one of the greatest finals ever played. Messi's long-awaited World Cup, at age 35.",Argentina,France,Germany,Brazil,A,,2,global,stable,2026-04-23,
sports-027,sports,Which country won UEFA Euro 2024?,"Spain (a record 4th European Championship title, beating England 2–1 in Berlin)",Final played in Berlin. Spain beat England 2–1 to take a record fourth European title.,Spain,Germany,France,England,A,,2,global,stable,2026-04-23,
sports-028,sports,How many Tour de France overall wins do the all-time co-leaders have?,"5 each — Jacques Anquetil, Eddy Merckx, Bernard Hinault, and Miguel Indurain (Lance Armstrong's 7 were stripped)","Anquetil (1957, 1961–64), Merckx (1969–72, 1974), Hinault (1978–79, 1981–82, 1985), Indurain (1991–95 consecutive). Armstrong's seven wins (1999–2005) were stripped in 2012 for doping.",4,5,6,7,B,,2,global,stable,2026-04-23,
sports-029,sports,Who holds the men's all-time record for international football goals?,Cristiano Ronaldo (Portugal) — over 140 and still rising as of 2026,Over 140 international goals. The gap to second-place Ali Daei (109) is substantial — and Ronaldo is still adding to it.,Lionel Messi,Cristiano Ronaldo,Sunil Chhetri,Ali Daei,B,,2,global,current,2026-04-23,
sports-030,sports,Who holds the men's all-time record for Grand Slam singles titles?,"Novak Djokovic, with 24",Passed Nadal (22) and Federer (20) in 2023. Ten Australian Open titles alone. Longevity is the defining feature of his career.,Pete Sampras,Novak Djokovic,Rafael Nadal,Roger Federer,B,,2,global,periodic,2026-04-23,
sports-031,sports,What is the oldest of the four tennis Grand Slam tournaments?,Wimbledon (first held 1877),First tournament in 1877 had 22 competitors. Now the most prestigious event in tennis.,The French Open,The US Open,Wimbledon,The Australian Open,C,,2,global,periodic,2026-04-23,
sports-032,sports,Who has won the most Olympic medals of any athlete in history?,"Michael Phelps (28 total, 23 gold — US swimmer)",28 total Olympic medals; 23 gold. Four Olympics (2004–16). More individual Olympic golds (13) than any athlete since Leonidas of Rhodes (152 BCE).,Carl Lewis,Usain Bolt,Michael Phelps,Larisa Latynina,C,,2,global,stable,2026-04-23,
sports-033,sports,How many FIFA World Cups did Pelé win?,"3 (with Brazil in 1958, 1962, and 1970)","1958 (aged 17), 1962 and 1970 — the only man to win three World Cups as a player. Real name Edson Arantes do Nascimento.",1,3,2,4,B,,2,global,stable,2026-04-23,
sports-034,sports,Which NBA franchise has won the most championships?,"The Boston Celtics (18, after the 2024 title)","Won their 18th title in 2024, breaking a tie with the LA Lakers (17). First NBA franchise to reach 18.",The Golden State Warriors,The Chicago Bulls,The Boston Celtics,The LA Lakers,C,,2,global,periodic,2026-04-23,
sports-035,sports,Who set the men's marathon world record at Chicago in October 2023?,Kelvin Kiptum of Kenya (2:00:35); he died in a road accident in February 2024,"2:00:35 at Chicago, 8 October 2023. Broke Eliud Kipchoge's record by 34 seconds. Killed in a road accident in Kenya on 11 February 2024, aged 24 — a major loss to the sport.",Evans Chebet,Kelvin Kiptum,Eliud Kipchoge,Kenenisa Bekele,B,,2,global,periodic,2026-04-23,
sports-036,sports,Which country won the first FIFA Women's World Cup in 1991?,The United States,"Inaugural tournament in China. The USWNT has since won four titles total (1991, 1999, 2015, 2019) — more than any other country.",Germany,The United States,Norway,Sweden,B,,2,global,stable,2026-04-23,
sports-037,sports,"Which Dutch footballer popularised ""Total Football"" as both a player and coach?",Johan Cruyff,"Dutch style in which every outfield player is comfortable in any position. Developed at Ajax under coach Rinus Michels, then transferred to Barcelona by Cruyff as player and coach. Cruyff died in 2016.",Marco van Basten,Ruud Gullit,Johan Cruyff,Rinus Michels,C,,2,netherlands,stable,2026-04-23,
sports-038,sports,Who won the 2025 Men's Ballon d'Or?,Ousmane Dembélé (PSG and France),Based on his explosive 2024–25 season with PSG. Ended a Messi/Ronaldo-dominated era. First Frenchman to win since Benzema (2022).,Lamine Yamal,Ousmane Dembélé,Jude Bellingham,Erling Haaland,B,,2,global,annual,2026-04-23,
sports-039,sports,How many consecutive Formula 1 World Drivers' Championships did Max Verstappen win from 2021 to 2024?,4 (the 2025 title went to Lando Norris),"2021–2024 consecutively. Lando Norris (McLaren) broke the streak in 2025, becoming the first British champion since Hamilton in 2020.",2,3,4,5,C,,2,global,stable,2026-04-23,
sports-040,sports,What is Usain Bolt's world record for the men's 100m?,"9.58 seconds (set in Berlin, 2009)",Set in Berlin at the World Championships on 16 August 2009. Often cited as near the physical limit of modern sprinting. Bolt retired in 2017.,9.58 seconds,9.69 seconds,9.50 seconds,9.74 seconds,A,,2,global,periodic,2026-04-23,
sports-041,sports,Who was the first winner of the Ballon d'Or in 1956?,Stanley Matthews (England),Won at age 41 — still the oldest winner ever. Played for Blackpool and Stoke City. Kept playing top-flight English football into his 50s.,Lev Yashin,Alfredo Di Stéfano,Bobby Charlton,Stanley Matthews,D,,2,global,annual,2026-04-23,
sports-042,sports,Which country won the 2023 Rugby World Cup (their 4th title)?,South Africa,"Fourth Rugby World Cup title (1995, 2007, 2019, 2023), making them the most successful rugby nation. Won all three 2023 knockout games by a single point.",New Zealand,England,France,South Africa,D,,2,global,stable,2026-04-23,
sports-043,sports,At which Olympics did skateboarding make its Games debut?,Tokyo 2020 (held in 2021),"Debut at Tokyo 2020 (held in 2021 due to COVID). Youngest gold medallist was Momiji Nishiya of Japan, aged 13.",Tokyo 2020,London 2012,Sochi 2014,Rio 2016,A,,2,global,stable,2026-04-23,
sports-044,sports,How many players does a volleyball team have on court at once?,6,Plus a libero (defensive specialist) who can substitute freely in back-row positions. Beach volleyball has just two per side.,6,8,5,7,A,,2,global,stable,2026-04-23,
sports-045,sports,Which city will host the 2028 Summer Olympics?,Los Angeles,"LA's third Olympics (1932, 1984, 2028). Will reportedly use almost entirely existing venues.",Paris,Tokyo,Brisbane,Los Angeles,D,,2,global,stable,2026-04-23,
sports-046,sports,Which three countries are jointly hosting the 2026 Men's FIFA World Cup?,"The United States, Canada, and Mexico",First World Cup jointly hosted by three countries. Also the first with 48 teams (up from 32). Final in New Jersey.,"The United States, Canada, and Mexico","The United States, Mexico, and Brazil","Canada, the United States, and Argentina","Mexico, the United States, and Colombia",A,,2,global,stable,2026-04-23,
sports-047,sports,"Who holds the men's long jump world record, set at the 1991 World Championships in Tokyo?",Mike Powell (8.95m),Still stands after 30+ years — one of the longest-held records in athletics. Broke Bob Beamon's legendary 1968 Mexico City mark of 8.90m.,Bob Beamon (8.90m),Mike Powell (8.95m),Iván Pedroso (8.71m),Carl Lewis (8.87m),B,,2,global,periodic,2026-04-23,
sports-048,sports,Which Dutch player won the Wimbledon men's singles title in 1996?,Richard Krajicek,Beat MaliVai Washington in the final. Still the only Dutchman to have won a Grand Slam men's singles title.,Tom Okker,Jacco Eltingh,Richard Krajicek,Paul Haarhuis,C,,2,netherlands,stable,2026-04-23,
sports-049,sports,How many holes are in a standard round of golf?,18,Standardised by the Royal and Ancient at St Andrews (Scotland) in 1858. Total par is typically 72.,36,9,18,24,C,,2,global,stable,2026-04-23,
sports-050,sports,"Who is the only tennis player to win a ""Golden Slam"" (all four majors plus Olympic gold in the same calendar year)?",Steffi Graf (1988),"1988 — Australian Open, French Open, Wimbledon, US Open, plus Olympic gold in Seoul. No one else — man or woman — has done it in a single calendar year.",Chris Evert,Serena Williams,Martina Navratilova,Steffi Graf,D,,2,global,stable,2026-04-23,
language-026,language,What is the currency of the United Kingdom?,The pound sterling (£),"£, GBP. The world's oldest currency still in use, dating to roughly 775 CE — predating the Bank of England (founded 1694).",The euro,The pound sterling,The guinea,The shilling,B,,2,global,stable,2026-04-23,
language-027,language,What is the currency of South Africa?,The rand,"Named after the Witwatersrand, the gold-bearing ridge at Johannesburg. Introduced in 1961, replacing the pound.",The pula,The dollar,The rand,The rupee,C,,2,global,stable,2026-04-23,
