id,category,question,answer,context,option_a,option_b,option_c,option_d,correct_letter,notes,difficulty,region_tag,volatility,last_verified,source
art-078,art,"The Hellenistic sculpture ""Winged Victory of Samothrace"" is displayed in which museum?","The Louvre, Paris","2nd century BCE, found on Samothrace in 1863. Marble depicting the goddess Nike (Victory). Displayed at the top of the Louvre's main staircase. Missing head and arms — but what remains is breathtaking.",The Acropolis Museum (Athens),The Metropolitan Museum (New York),The Louvre (Paris),The British Museum (London),C,,2,global,stable,2026-04-23,
art-079,art,"The small bronze statue ""Manneken Pis"" is in which city?",Brussels,"About 55cm tall bronze fountain from 1619. One of Brussels's top tourist attractions. Dressed in different outfits several times a week — wardrobe of over 1,000 costumes. Female counterpart 'Jeanneke Pis' (1987) also exists nearby.",Brussels,Luxembourg City,Paris,Amsterdam,A,,2,global,stable,2026-04-23,
art-080,art,In which city does the Christ the Redeemer statue overlook the bay?,Rio de Janeiro,"38m tall, atop Corcovado Mountain. Built 1922–1931 using Brazilian soapstone over reinforced concrete. One of the New 7 Wonders of the World (2007).",Rio de Janeiro,São Paulo,Lima,Buenos Aires,A,,2,global,stable,2026-04-23,
art-081,art,Who designed the Statue of Liberty (with Gustave Eiffel designing its internal iron framework)?,Frédéric Auguste Bartholdi,Gifted by France to the US for the centenary of American independence. The crown has seven points representing the continents and seas. Gustave Eiffel designed the internal iron framework. Shipped across the Atlantic in 350 separate pieces.,Frédéric Auguste Bartholdi,Alexandre Falguière,Auguste Rodin,Gustave Eiffel,A,,2,global,stable,2026-04-23,
art-082,art,In which year was the Statue of Liberty dedicated?,1886,"Dedicated 28 October 1886 by President Grover Cleveland. A welcoming symbol to immigrants arriving at Ellis Island. Emma Lazarus's poem 'The New Colossus' — 'Give me your tired, your poor...' — is on the pedestal.",1892,1886,1901,1876,B,,2,global,stable,2026-04-23,
art-083,art,Which famous Frank Lloyd Wright house is built directly over a waterfall?,"Fallingwater (Pennsylvania, completed 1937)","Designed 1935, completed 1937 for the Kaufmann family. Cantilevered directly over Bear Run waterfall in Pennsylvania. Widely considered the greatest American house of the 20th century. Now a museum.",Fallingwater,Robie House,Hollyhock House,Taliesin West,A,,2,global,stable,2026-04-23,
art-084,art,Of what nationality was the architect Zaha Hadid (1950–2016)?,Iraqi-British,"1950–2016. Born in Baghdad. First woman to win the Pritzker Prize (2004). Radical curving forms — MAXXI Rome, London Aquatics Centre, Guangzhou Opera House.",Iranian-British,Lebanese-French,Iraqi-British,Egyptian-American,C,,2,global,stable,2026-04-23,
art-085,art,"Which 17th-century Dutch painter is most associated with Haarlem and the portrait ""The Laughing Cavalier""?",Frans Hals,"About 1582–1666. Dutch Golden Age master of informal, spontaneous portraits. 'The Laughing Cavalier' (1624) — though the subject isn't actually laughing. The Frans Hals Museum is in Haarlem.",Frans Hals,Rembrandt van Rijn,Jan Steen,Johannes Vermeer,A,,2,netherlands,stable,2026-04-23,
art-086,art,"Which Dutch Golden Age painter is known for lively, humorous genre scenes (like ""The Feast of St. Nicholas"")?",Jan Steen,"About 1626–1679. Chaotic domestic scenes. 'A Jan Steen household' is a Dutch idiom for a messy, disorderly home. He ran a tavern as well as painting.",Pieter de Hooch,Gerard ter Borch,Jan Steen,Adriaen van Ostade,C,,2,netherlands,stable,2026-04-23,
art-087,art,Ansel Adams is most famous for black-and-white photography of which subject?,"American landscapes, especially Yosemite National Park","1902–1984. Hugely influential in environmental conservation. Developed the 'Zone System' of exposure. Images like 'Moonrise, Hernandez' and 'Clearing Winter Storm' are iconic.","American landscapes, especially Yosemite",Urban New York street scenes,European cathedrals and cityscapes,Portraits of Hollywood stars,A,,2,global,stable,2026-04-23,
art-088,art,"Which French photographer coined the phrase ""the decisive moment""?",Henri Cartier-Bresson,"1908–2004. Co-founded Magnum Photos in 1947. 'The decisive moment' = the precise instant when composition, timing, and subject coalesce. Champion of the 35mm Leica.",Robert Capa,Henri Cartier-Bresson,André Kertész,Brassaï,B,,2,global,stable,2026-04-23,
art-089,art,"Which early-20th-century Italian art movement glorified speed, machinery, and modernity?","Futurism (founded by Filippo Tommaso Marinetti, 1909)","Manifesto published by Marinetti in Le Figaro, 1909. Celebrated speed, machines, violence, youth. Artists: Boccioni, Balla, Severini. Reputation tainted by later fascist associations.",Suprematism,Constructivism,Futurism,Vorticism,C,,2,global,stable,2026-04-23,
art-090,art,Which anti-art movement arose in Zurich in 1916 as a response to WWI?,Dada (Dadaism),"Founded at Zurich's Cabaret Voltaire in 1916. A reaction to the absurdity of WWI. Tzara, Arp, Ball. Laid the groundwork for Surrealism. The name was supposedly chosen at random from a dictionary.",Surrealism,Dada,Futurism,Expressionism,B,,2,global,stable,2026-04-23,
art-091,art,"For which Italian city was Michelangelo's marble ""David"" originally commissioned?",Florence (completed 1504),Commissioned 1501 for Florence Cathedral. Moved instead to the Piazza della Signoria in 1504 as a political symbol of the Florentine Republic. Now at the Galleria dell'Accademia.,Florence,Milan,Rome,Venice,A,,2,global,stable,2026-04-23,
art-092,art,"Who painted ""Les Demoiselles d'Avignon"" (1907), a work that anticipated Cubism?",Pablo Picasso,"Shocking at the time (1907) — five nude prostitutes, two with African-mask-like faces. Picasso kept it private for years before exhibiting publicly. Now at MoMA in New York.",Paul Cézanne,Pablo Picasso,Georges Braque,Henri Matisse,B,,2,global,stable,2026-04-23,
art-093,art,"Which British sculptor is famous for his large, abstracted bronze reclining figures?",Henry Moore,"1898–1986. English. Flowing, abstracted reclining figures in bronze and stone. Deeply influenced by pre-Columbian and natural forms. One of the UK's most important 20th-century sculptors.",Anthony Caro,Barbara Hepworth,Henry Moore,Jacob Epstein,C,,2,global,stable,2026-04-23,
art-094,art,"Which Venetian Renaissance master painted ""Assumption of the Virgin"" in the Frari church?",Titian (Tiziano Vecellio),About 1516–1518. In Venice's Basilica dei Frari. One of the first truly 'dynamic' Renaissance altarpieces — a radical shift from static medieval composition. Titian died of plague in 1576 around age 86.,Tintoretto,Veronese,Giorgione,Titian,D,,2,global,stable,2026-04-23,
art-095,art,Which famous 1945 Alfred Eisenstaedt photograph shows a sailor kissing a nurse in Times Square?,"""V-J Day in Times Square""","Taken 14 August 1945 as news of Japan's surrender spread. The sailor and nurse were not a couple — probably strangers. The nurse, later identified as Greta Zimmer Friedman, described the kiss in interviews as unexpected and non-consensual.","""Victory Kiss""","""V-J Day in Times Square""","""The Kiss""","""Moulin Rouge Kiss""",B,,2,global,stable,2026-04-23,
art-096,art,Which 1930 New York skyscraper is celebrated as an Art Deco masterpiece with a stainless-steel spire?,The Chrysler Building,319m tall. Briefly the world's tallest building (1930–31) before the Empire State Building surpassed it. Built by Walter Chrysler of the car company. Stainless-steel sunburst crown is unmistakable.,The Chrysler Building,The Empire State Building,The Woolworth Building,30 Rockefeller Plaza,A,,2,global,stable,2026-04-23,
art-097,art,"Which Italian Baroque sculptor created the marble group ""Apollo and Daphne"" (1622–25)?",Gian Lorenzo Bernini,"Marble. Captures the exact moment Daphne transforms into a laurel tree to escape Apollo. Technical virtuosity — the leaves are translucently thin. Bernini was only about 24 when he began it. At the Galleria Borghese, Rome.",Gian Lorenzo Bernini,Antonio Canova,Donatello,Michelangelo,A,,2,global,stable,2026-04-23,
art-098,art,"Who painted ""The Raft of the Medusa"" (1819), a French Romantic masterpiece?",Théodore Géricault,Painted 1819. Depicts survivors of the 1816 Méduse shipwreck off Mauritania — a political scandal of royal incompetence. Géricault interviewed survivors and visited morgues to study decomposing bodies. Died in 1824 aged just 32.,Eugène Delacroix,Jacques-Louis David,Théodore Géricault,Jean-Auguste-Dominique Ingres,C,,2,global,stable,2026-04-23,
art-099,art,"Which art movement, associated with Donald Judd and Agnes Martin, emphasises extreme simplicity?",Minimalism,"1960s American movement reacting against the emotionalism of Abstract Expressionism. Focused on industrial materials, geometric forms, serial repetition. 'What you see is what you see' — Frank Stella.",Conceptualism,Pop Art,Minimalism,Colour Field painting,C,,2,global,stable,2026-04-23,
art-100,art,"Which 19th-century Japanese ukiyo-e artist produced the ""Fifty-three Stations of the Tōkaidō"" series?",Utagawa Hiroshige,"1797–1858. Master of ukiyo-e ('pictures of the floating world'). '53 Stations' depicts the road from Edo (Tokyo) to Kyoto. Heavily influenced European Impressionism via the Japonisme craze — Van Gogh, Monet and Whistler all copied him directly.",Utagawa Hiroshige,Tōshūsai Sharaku,Katsushika Hokusai,Kitagawa Utamaro,A,,2,global,stable,2026-04-23,
sports-076,sports,Who won the first modern Olympic marathon at Athens 1896?,Spyridon Louis (Greece),"Greek water carrier. Dark horse winner in 2:58:50. National hero — reportedly offered a horse, free meals for life, and more. Still the only Greek Olympic marathon champion.",Michel Théato (France),Arthur Blake (USA),Johnny Hayes (USA),Spyridon Louis (Greece),D,,2,global,stable,2026-04-23,
sports-077,sports,How many gold medals did Jesse Owens win at the 1936 Berlin Olympics?,"4 (100m, 200m, long jump, 4×100m relay)",Owens's four golds in Berlin directly embarrassed Nazi racial ideology. Hitler did not shake his hand (though he reportedly refused to shake most winners' hands after the first day). Owens struggled for recognition back in segregated America.,6,3,4,5,C,,2,global,stable,2026-04-23,
sports-078,sports,"Which Dutch athlete, nicknamed ""The Flying Housewife,"" won 4 gold medals at the 1948 London Olympics?",Fanny Blankers-Koen,"Won 100m, 200m, 80m hurdles and the 4x100m relay — aged 30 and mother of two. The 'housewife' nickname was initially a sneer from those who doubted her. Named IAAF Female Athlete of the Century in 1999.",Wilma Rudolph,Babe Didrikson Zaharias,Jackie Joyner-Kersee,Fanny Blankers-Koen,D,,2,netherlands,stable,2026-04-23,
sports-079,sports,"Which Czech runner won gold in the 5000m, 10,000m, and marathon at the 1952 Helsinki Olympics?",Emil Zátopek,"Won all three long-distance events in Helsinki — including the marathon, which he'd never run before. Known for his grimacing running style. Later persecuted in Czechoslovakia after the 1968 Prague Spring.",Paavo Nurmi,Emil Zátopek,Abebe Bikila,Haile Gebrselassie,B,,2,global,stable,2026-04-23,
sports-080,sports,Which American sprinter and long jumper won 9 Olympic gold medals across four Games?,Carl Lewis,US sprinter and long jumper. 9 Olympic golds across four Games (1984–1996). Matched Jesse Owens's four-gold 1936 haul at his 1984 LA debut.,Jesse Owens,Carl Lewis,Usain Bolt,Michael Johnson,B,,2,global,stable,2026-04-23,
sports-081,sports,Which Ethiopian won the 1960 Rome Olympic marathon running barefoot?,Abebe Bikila,Ran barefoot because his sponsor's shoes hurt his feet. 2:15:16 — world record. First African to win Olympic gold. Defended the title in Tokyo 1964 (with shoes this time).,Kenenisa Bekele,Mamo Wolde,Haile Gebrselassie,Abebe Bikila,D,,2,global,stable,2026-04-23,
sports-082,sports,Which player broke Major League Baseball's colour barrier in 1947?,Jackie Robinson,Debuted with the Brooklyn Dodgers on 15 April 1947. Endured horrific racist abuse. His number 42 is the only number retired across all MLB teams.,Willie Mays,Satchel Paige,Jackie Robinson,Larry Doby,C,,2,global,stable,2026-04-23,
sports-083,sports,Which Australian cricketer finished his Test career with a batting average of 99.94?,Sir Donald Bradman,His 99.94 Test batting average is probably the most remarkable record in any sport. Needed only a four-run single in his last innings to average 100 — got out for a duck.,Garfield Sobers,Jack Hobbs,Sachin Tendulkar,Donald Bradman,D,,2,global,stable,2026-04-23,
sports-084,sports,Which Brazilian Formula 1 driver died at Imola in 1994?,Ayrton Senna,1 May 1994 at the Imola circuit (San Marino Grand Prix). Three-time world champion. Died of head injuries after crashing into a concrete wall. Roland Ratzenberger had died in qualifying the previous day. The tragedy led to F1's biggest safety overhaul.,François Cevert,Ayrton Senna,Jim Clark,Gilles Villeneuve,B,,2,global,stable,2026-04-23,
sports-085,sports,Who founded the Ferrari car and racing company?,Enzo Ferrari,"1898–1988. Founded Scuderia Ferrari in 1929 (initially as Alfa Romeo's racing team), then Ferrari road cars in 1947. Ferocious personality. Company still based in Maranello, Italy.",Luigi Chinetti,Enzo Ferrari,Battista Pininfarina,Ettore Bugatti,B,,2,global,stable,2026-04-23,
sports-086,sports,How many major golf championships did Jack Nicklaus win?,18 (the men's record),"6 Masters, 5 PGA Championships, 4 US Opens, 3 Open Championships. Won across four decades (1962–1986). Usually considered the greatest golfer of all time.",15,16,20,18,D,,2,global,stable,2026-04-23,
sports-087,sports,How many golf majors has Tiger Woods won?,15 (most recent: the 2019 Masters),"Masters 1997, 2001, 2002, 2005, 2019; US Open 2000, 2002, 2008; Open 2000, 2005, 2006; PGA 1999, 2000, 2006, 2007. The 2019 Masters was a remarkable comeback after multiple back surgeries.",16,14,13,15,D,,2,global,stable,2026-04-23,
sports-088,sports,Which tennis Grand Slam is played on clay?,Roland-Garros (the French Open),"Named after the French aviator Roland Garros (died 1918). Played on red clay ('terre battue') — slow, high-bouncing, physically demanding. Nadal's dominance there (14 titles) is unprecedented in tennis.",The French Open (Roland Garros),Wimbledon,The US Open,The Australian Open,A,,2,global,stable,2026-04-23,
sports-089,sports,Which tennis Grand Slam is played in New York?,The US Open,"Played at Flushing Meadows, Queens, since 1978. Only slam with tiebreakers in the deciding set — since 2022 all slams use the 10-point 'super tiebreak' at 6–6 in the final set.",The French Open,The US Open,Wimbledon,The Australian Open,B,,2,global,stable,2026-04-23,
sports-090,sports,How many men's singles Grand Slam titles did Roger Federer win?,20,"8 Wimbledon, 6 Australian Open, 5 US Open, 1 French Open. Career spanned 2003–2018. Retired in 2022.",18,20,21,17,B,,2,global,stable,2026-04-23,
sports-091,sports,How many men's singles Grand Slam titles did Rafael Nadal win?,22,"14 French Open, 4 US Open, 2 Wimbledon, 2 Australian Open. The King of Clay. Retired in 2024.",20,24,21,22,D,,2,global,stable,2026-04-23,
sports-092,sports,"Who holds the most women's singles Grand Slam titles in the Open Era, with 23?",Serena Williams,"7 Australian Open, 7 Wimbledon, 6 US Open, 3 French Open. One short of Margaret Court's all-time record of 24. Retired in 2022.",Venus Williams,Serena Williams,Steffi Graf,Martina Navratilova,B,,2,global,stable,2026-04-23,
sports-093,sports,What is the nickname of the New Zealand men's national rugby team?,The All Blacks,Most successful team in international rugby history. Win rate around 77% across all tests. 3 Rugby World Cup titles. Named for their all-black playing kit.,The Pumas (Argentina),The Springboks (South Africa),The All Blacks (New Zealand),The Wallabies (Australia),C,,2,global,stable,2026-04-23,
sports-094,sports,What is the ceremonial Māori war dance the All Blacks perform before matches?,The haka,"The best-known haka is 'Ka Mate', composed around 1820 by Te Rauparaha. The more aggressive 'Kapa o Pango' was introduced in 2005. A traditional Māori challenge and greeting, not a war dance despite the popular label.",The tamure,The waiata,The haka,The lomi,C,,2,global,stable,2026-04-23,
sports-095,sports,"Which boxer is famously nicknamed ""Iron Mike""?",Mike Tyson,Born 1966. Youngest heavyweight champion ever at age 20. Pro career 1986–2005. Infamously bit off part of Evander Holyfield's ear in 1997.,George Foreman,Lennox Lewis,Evander Holyfield,Mike Tyson,D,,2,global,stable,2026-04-23,
sports-096,sports,Which Italian rider won 9 Grand Prix motorcycle world titles (including 7 in MotoGP/500cc)?,Valentino Rossi,"9 world titles — 7 in MotoGP (premier class), plus earlier titles in 125cc and 250cc. Retired 2021. 'The Doctor' — personality star who took MotoGP global.",Giacomo Agostini,Marc Márquez,Jorge Lorenzo,Valentino Rossi,D,,2,global,stable,2026-04-23,
sports-097,sports,Which three countries will jointly host the main stages of the 2030 FIFA Men's World Cup?,"Morocco, Portugal, and Spain (with centenary matches in Uruguay, Argentina, and Paraguay)","Main stages in Morocco, Portugal and Spain. Centenary opening matches in Uruguay, Argentina and Paraguay to mark 100 years since Uruguay 1930. First World Cup across three continents.","Morocco, Portugal, and Spain (with matches in Uruguay, Argentina, and Paraguay)",Spain and Portugal alone,"Morocco, Algeria, and Tunisia","The United States, Mexico, and Canada",A,,2,global,stable,2026-04-23,
sports-098,sports,What do the five Olympic rings represent?,The five inhabited continents,"Representing the five inhabited continents — Europe, Asia, Africa, the Americas (counted as one) and Oceania. Antarctica is excluded (no permanent population). Colours chosen so every national flag has at least one.",The five inhabited continents,The four major Olympic sports,"The Earth, sky, and seas",The Olympic founding countries,A,,2,global,stable,2026-04-23,
sports-099,sports,How many events make up a men's decathlon?,10,"10 events over two days: 100m, long jump, shot put, high jump, 400m, 110m hurdles, discus, pole vault, javelin, 1500m. The gold medallist is traditionally called 'the world's greatest athlete'.",8,12,10,7,C,,2,global,stable,2026-04-23,
sports-100,sports,How many disciplines make up a standard triathlon?,"3 (swim, bike, run)",Swim/bike/run. Olympic distance: 1.5km / 40km / 10km. Ironman distance: 3.8km / 180km / 42.2km (full marathon). Originated in Hawaii in 1978.,2,4,3,5,C,,2,global,stable,2026-04-23,
language-076,language,What is the fear of open or public spaces called?,Agoraphobia,From Greek 'agora' (marketplace). Often involves fear of situations from which escape feels difficult. Can be seriously debilitating.,Acrophobia,Social anxiety,Agoraphobia,Xenophobia,C,,2,global,stable,2026-04-23,
language-077,language,What is the fear of water called?,Hydrophobia (also known as aquaphobia),From Greek 'hydor' (water). Historically also described a rabies symptom — painful swallowing. Modern fear of water is more often called 'aquaphobia'.,Hydrophobia,Bathophobia,Thalassophobia,Aquaphobia,A,,2,global,stable,2026-04-23,
language-078,language,What is the fear of public speaking called?,Glossophobia,From Greek 'glossa' (tongue). Estimated to affect around 75% of people to some degree. Consistently rated in surveys as more feared than death — the origin of Jerry Seinfeld's joke.,Demophobia,Logophobia,Agoraphobia,Glossophobia,D,,2,global,stable,2026-04-23,
language-079,language,What is a group of giraffes called?,A tower,'Tower' is the classic collective noun — poetic. Giraffes form loose social groups without strong hierarchies.,A tower,A column,A gallop,A herd,A,,2,global,stable,2026-04-23,
language-080,language,What is a group of zebras called?,"A dazzle (also sometimes a ""zeal"")",A 'dazzle' refers to how their stripes confuse predators when the herd moves together. Zebras can sprint at up to 65 km/h.,A herd,A dazzle (or zeal),A cross,A pod,B,,2,global,stable,2026-04-23,
language-081,language,What is a baby horse called?,A foal (male: colt; female: filly),"General term for a young horse under one year. Colt = male, filly = female. Weanling = just weaned; yearling = 1–2 years old.",A yearling,A foal,A filly,A colt,B,,2,global,stable,2026-04-23,
language-082,language,What is a baby deer called?,A fawn,Typically spotted at birth for camouflage. They lose the spots around 3–4 months. 'Fawn' is also an English colour name — a pale yellowish-brown.,A cub,A fawn,A kit,A calf,B,,2,global,stable,2026-04-23,
language-083,language,What is a baby cow called?,A calf,"Also used for young whales, elephants, seals, rhinos and hippos. Cows give birth after about nine months of gestation.",A calf,A kit,A pup,A joey,A,,2,global,stable,2026-04-23,
language-084,language,"What does ""GDP"" stand for?",Gross Domestic Product,"Concept developed by economist Simon Kuznets in the 1930s. Standard measure of economic output since WWII. Critics — including Kuznets himself — note that GDP ignores distribution, wellbeing, unpaid work and ecological damage.",General Domestic Production,Gross Domestic Product,Gross Direct Product,Global Direct Product,B,,2,global,stable,2026-04-23,
language-085,language,"What does ""WHO"" stand for?",The World Health Organization,"UN specialised agency, founded 1948. Based in Geneva. Led the global responses to smallpox eradication, HIV/AIDS and COVID-19.",World Health Organisation Office,Worldwide Healthcare Organisation,World Health Organization,World Hygiene Organization,C,,2,global,stable,2026-04-23,
language-086,language,"What does ""UNESCO"" stand for?","United Nations Educational, Scientific and Cultural Organization","Founded 1945. Headquartered in Paris. Best known for the World Heritage Sites list — over 1,200 sites as of 2026.","United Nations Environmental, Scientific and Communications Organization","United Nations Educational, Scientific and Cultural Organization","United Nations Education, Science and Cultural Office",United Nations Economic and Social Council,B,,2,global,stable,2026-04-23,
language-087,language,"What does ""UNICEF"" stand for?",United Nations Children's Fund (originally UN International Children's Emergency Fund),Founded 1946 for post-war European children. Expanded to worldwide children's aid. The 'E' originally stood for 'Emergency' — kept in the acronym long after the name was shortened.,United Nations International Children's Emergency Fund,United Nations Intercultural Children's Fund,United International Children's Emergency Fund,UN Children's Equity Fund,A,,2,global,stable,2026-04-23,
language-088,language,How many official languages does the United Nations use?,"6 (Arabic, Chinese, English, French, Russian, Spanish)","Arabic, Chinese (Mandarin), English, French, Russian, Spanish. Documents are published in all six. Arabic was the last added, in 1973.",5,6,7,4,B,,2,global,stable,2026-04-23,
language-089,language,What is the currency of South Korea?,The won,"KRW. 1 won = 100 jeon. The highest common banknote is ₩50,000 (around €33). North Korea uses a separate 'won' as well.",The won,The yen,The kip,The yuan,A,,2,global,stable,2026-04-23,
language-090,language,What is the currency of Thailand?,The baht,THB. 1 baht = 100 satang. Thailand avoided colonisation and kept its currency continuous throughout the colonial era.,The baht,The kip,The ringgit,The dong,A,,2,global,stable,2026-04-23,
language-091,language,What is the currency of Vietnam?,The đồng (VND),"VND. Heavily devalued — about 25,000 đồng to €1. The smallest banknote in common use is 1,000 đồng.",The kyat,The đồng,The baht,The riel,B,,2,global,stable,2026-04-23,
language-092,language,What is the currency of Poland?,The złoty,PLN. 'Złoty' literally means 'golden' in Polish. Poland has so far chosen to keep its currency rather than adopting the euro.,The forint,The koruna,The złoty,The euro,C,,2,global,stable,2026-04-23,
language-093,language,What is the currency of Hungary?,The forint,HUF. Named after the medieval Florentine florin. Hungary also keeps its own currency despite EU membership.,The leu,The forint,The koruna,The złoty,B,,2,global,stable,2026-04-23,
language-094,language,"What does the Latin phrase ""status quo"" mean?",The existing state of affairs,Latin shorthand from 'in statu quo ante' ('in the state things were in before'). Usually implies a mildly conservative preference for not changing things.,"""Quiet state"" or peace","""Previous status"" or the way things were","""Stalemate"" or deadlock","""Existing state"" or the current situation",D,,2,global,stable,2026-04-23,
language-095,language,"What does the Latin phrase ""ad hoc"" mean?","Literally ""for this"" — i.e., for a specific purpose or improvised","Often extended in English to 'ad hoc committee' and similar phrases. Carries a connotation of 'improvised' rather than planned — sometimes pejorative, sometimes just descriptive.","""In between""","""Routine""","""To the highest degree""","""For this purpose"" (improvised or situation-specific)",D,,2,global,stable,2026-04-23,
