id,category,question,answer,context,option_a,option_b,option_c,option_d,correct_letter,notes,difficulty,region_tag,volatility,last_verified,source
media-073,media,"Who composed the piano piece ""Clair de Lune""?","Claude Debussy (1890, published 1905)","Part of his 'Suite bergamasque' (1890, published 1905). Title means 'moonlight' in French — inspired by Paul Verlaine's poem.",Gabriel Fauré,Maurice Ravel,Claude Debussy,Erik Satie,C,,2,global,stable,2026-04-23,
media-074,media,"Which Dutch DJ, born Tijs Verwest, became one of the world's best-known trance/electronic producers?",Tiësto,Born in Breda in 1969. 'Adagio for Strings' (2005) and 'Traffic' (2003) were defining tracks of trance. Later pivoted to more mainstream EDM/pop.,Armin van Buuren,Martin Garrix,Hardwell,Tiësto,D,,2,netherlands,stable,2026-04-23,
media-075,media,"Who composed ""The Blue Danube"" waltz?",Johann Strauss II (1866),Premiered 1866 in Vienna after initial poor reception. Became Austria's unofficial second anthem. Features prominently in Kubrick's '2001: A Space Odyssey' (1968).,Josef Strauss,Johann Strauss II,Johann Strauss Sr.,Franz Lehár,B,,2,global,stable,2026-04-23,
art-051,art,Which Italian Baroque painter is associated with dramatic chiaroscuro (tenebrism)?,Caravaggio,"1571–1610. Pioneered dramatic light-dark contrasts. Killed a man in a brawl in Rome, fled, lived as a fugitive, died mysteriously on a beach. Rediscovered in the 20th century — neglected for centuries.",Nicolas Poussin,Caravaggio,Artemisia Gentileschi,Gian Lorenzo Bernini,B,,2,global,stable,2026-04-23,
art-052,art,"Who painted ""The Birth of Venus"" (c. 1485)?",Sandro Botticelli,"Around 1485, tempera on canvas. In the Uffizi, Florence. Venus stands on a scallop shell; model was probably Simonetta Vespucci, a Florentine beauty. Commissioned by the Medici family.",Sandro Botticelli,Titian,Raphael,Giorgione,A,,2,global,stable,2026-04-23,
art-053,art,"Who painted ""The School of Athens"" (1509–11, in the Vatican)?",Raphael (Raffaello Sanzio),"Fresco in the Vatican's Stanza della Segnatura, 1509–11. Depicts Plato, Aristotle, Socrates, Pythagoras, Euclid and others — with Plato's face modelled on Leonardo and Heraclitus on Michelangelo.",Raphael,Leonardo da Vinci,Perugino,Michelangelo,A,,2,global,stable,2026-04-23,
art-054,art,Who founded the Bauhaus school in 1919?,Walter Gropius,"Modernist design school founded in Weimar, 1919. Closed by the Nazis in 1933. Principles of 'form follows function' shaped modern design worldwide. Tutors included Klee, Kandinsky, Mies van der Rohe.",Marcel Breuer,Walter Gropius,Ludwig Mies van der Rohe,Wassily Kandinsky,B,,2,global,stable,2026-04-23,
art-055,art,"Which Russian avant-garde artist painted ""Black Square"" (1915)?",Kazimir Malevich,1879–1935. 'Black Square' was exhibited in 1915 as the 'zero point of painting' — a conscious rejection of representation. Founder of Suprematism. Later pressured under Stalin to return to figurative work.,Vladimir Tatlin,Kazimir Malevich,Wassily Kandinsky,Alexander Rodchenko,B,,2,global,stable,2026-04-23,
art-056,art,Wassily Kandinsky is regarded as a pioneer of what kind of art?,Abstract art,"1866–1944. Russian-born, trained as a lawyer. Claimed to have experienced synaesthesia — seeing colours when hearing music. His 1910 'Composition VII' is often cited as one of the first purely abstract paintings.",Expressionism,Cubism,Abstract Expressionism,Abstract art,D,,2,global,stable,2026-04-23,
art-057,art,Which art movement is most associated with Henri Matisse?,Fauvism,"1869–1954. Fauvism (1905–08) featured wild, unrealistic colours ('fauves' means 'wild beasts'). Later turned to cut-paper collages in old age after surgery left him unable to paint standing.",Cubism,Post-Impressionism,Expressionism,Fauvism,D,,2,global,stable,2026-04-23,
art-058,art,Edgar Degas is most famous for paintings of which subject?,Ballet dancers,"1834–1917. About half of his ~1,500 works feature dancers. Considered himself a Realist, not an Impressionist, despite exhibiting with the group. Failing eyesight pushed him from painting to sculpture and pastels.",Horses,Ballet dancers,Café scenes,Bathers,B,,2,global,stable,2026-04-23,
art-059,art,"Which Spanish Romantic painter made ""The Third of May 1808""?",Francisco Goya,1746–1828. 'The Third of May 1808' (1814) depicts Spanish civilians being executed by Napoleonic troops. His dark later 'Black Paintings' (1819–23) anticipated Expressionism by a century.,Bartolomé Esteban Murillo,Diego Velázquez,Jusepe de Ribera,Francisco Goya,D,,2,global,stable,2026-04-23,
art-060,art,"Who painted ""American Gothic"" (1930)?",Grant Wood,1891–1942. Depicts a farmer and his daughter (painted as Wood's sister and his dentist) standing before a small Gothic-Revival house in Iowa. Instantly iconic — one of the most parodied paintings in American culture.,Grant Wood,Edward Hopper,Thomas Hart Benton,Norman Rockwell,A,,2,global,stable,2026-04-23,
art-061,art,"Which Dada artist exhibited a urinal titled ""Fountain"" in 1917?",Marcel Duchamp,"1887–1968. 'Fountain' — a porcelain urinal signed 'R. Mutt' — was rejected from a 1917 exhibition. Became a cornerstone of conceptual art. Duchamp spent decades on his final secret work 'Étant donnés', revealed after his death.",Francis Picabia,Jean Arp,Man Ray,Marcel Duchamp,D,,2,global,stable,2026-04-23,
art-062,art,In which English county is Stonehenge located?,Wiltshire,"Wiltshire, England. Built in phases from about 3000 BCE to 1600 BCE. Megaliths weighing up to 25 tonnes; the bluestones were transported from Wales (~240 km away). Astronomical alignments with sunrise on summer solstice.",Dorset,Hampshire,Somerset,Wiltshire,D,,2,global,stable,2026-04-23,
art-063,art,What are the massive stone heads on Easter Island called?,Moai,"About 1,000 moai were carved by the Rapa Nui people between roughly 1250 and 1500 CE. Average height about 4m, the largest ~10m and 75 tonnes. Surprisingly, many have full bodies buried below the heads.",Tiki,Aku Aku,Moai,Olmec heads,C,,2,global,stable,2026-04-23,
art-064,art,Whose tomb is guarded by the Terracotta Army in Xi'an?,"Qin Shi Huang (first emperor of unified China, d. 210 BCE)","Qin Shi Huang, 259–210 BCE. First emperor to unify China. Over 8,000 life-sized terracotta soldiers (each with a different face) plus horses, chariots and officials — meant to protect him in the afterlife. Discovered by accident by local farmers in 1974.",Emperor Taizong of Tang,Kublai Khan,Han Wudi,Qin Shi Huang,D,,2,global,stable,2026-04-23,
art-065,art,The Alhambra palace is in which Spanish city?,Granada,"Granada, Andalusia. Built mostly under the Nasrid dynasty (13th–14th c), the last Muslim kingdom in Iberia. Surrendered to Ferdinand and Isabella in 1492 — the same year they funded Columbus.",Málaga,Seville,Granada,Córdoba,C,,2,global,stable,2026-04-23,
art-066,art,The Palace of Versailles was principally built for which French king?,Louis XIV (the Sun King),Louis XIV (reigned 1643–1715). Transformed his father's hunting lodge into one of Europe's grandest palaces. Court moved there from Paris in 1682. Designed partly to keep nobles under royal surveillance.,Louis XIII,Louis XV,Louis XVI,Louis XIV,D,,2,global,stable,2026-04-23,
art-067,art,In which city is the Centre Pompidou?,Paris,"Opened 1977. Designed by Renzo Piano and Richard Rogers with the building's 'guts' — pipes, ducts, escalators — on the outside. Houses the largest modern-art collection in Europe.",Paris,Nice,Lyon,Marseille,A,,2,global,stable,2026-04-23,
art-068,art,In which city is the Van Gogh Museum?,Amsterdam,Opened 1973 on Amsterdam's Museumplein. Houses the largest collection of Van Gogh works in the world — over 200 paintings and 500 drawings. Extension by Kisho Kurokawa added in 1999.,Zundert,Amsterdam,The Hague,Otterlo,B,,2,netherlands,stable,2026-04-23,
art-069,art,In which Dutch city is the Mauritshuis museum?,"The Hague (home to Vermeer's ""Girl with a Pearl Earring"")","The Hague. A compact 17th-century nobleman's house turned museum. Houses Vermeer's 'Girl with a Pearl Earring' and 'View of Delft', plus works by Rembrandt, Rubens and Hals.",Delft,Amsterdam,The Hague,Rotterdam,C,,2,netherlands,stable,2026-04-23,
art-070,art,The Kröller-Müller Museum in Otterlo holds the world's second-largest collection of works by which artist?,Vincent van Gogh,Kröller-Müller Museum holds around 90 paintings and 180 drawings — the world's second-largest Van Gogh collection after the Van Gogh Museum in Amsterdam. Set in the Hoge Veluwe national park.,Johannes Vermeer,Piet Mondrian,Vincent van Gogh,Rembrandt van Rijn,C,,2,netherlands,stable,2026-04-23,
art-071,art,"Who sculpted ""Cloud Gate"" (nicknamed ""The Bean"") in Chicago's Millennium Park?",Anish Kapoor,"Born India 1954, British-based. Stainless-steel sculpture installed 2006. Reflects Chicago's skyline back at viewers. 'The Bean' is now one of the city's defining landmarks.",Richard Serra,Anish Kapoor,Jeff Koons,Damien Hirst,B,,2,global,stable,2026-04-23,
art-072,art,Which contemporary American artist is famous for large balloon-animal sculptures?,Jeff Koons,Born 1955. Balloon Dog (Orange) sold for $58.4 million in 2013 — then the record for a living artist at auction. His work polarises critics — celebrated as pop-art brilliance or dismissed as kitsch.,Jeff Koons,Takashi Murakami,KAWS,Damien Hirst,A,,2,global,stable,2026-04-23,
art-073,art,Of what nationality was the Renaissance artist Albrecht Dürer?,German,"1471–1528. From Nuremberg. His woodcuts and engravings ('Knight, Death and the Devil', 'Melencolia I') are among the most technically accomplished ever made. Self-portraits were unusually introspective for his time.",Dutch,Flemish,German,Austrian,C,,2,global,stable,2026-04-23,
art-074,art,"Which German Romantic painter made ""Wanderer above the Sea of Fog""?",Caspar David Friedrich,1774–1840. The Romantic landscape painter par excellence — solitary figures contemplating vast natural scenes. 'Wanderer above the Sea of Fog' (1818) is among the most recognisable Romantic paintings.,Caspar David Friedrich,Adolph Menzel,Philipp Otto Runge,Arnold Böcklin,A,,2,global,stable,2026-04-23,
art-075,art,El Greco (born in Crete) spent most of his career working in which country?,Spain (mostly in Toledo),1541–1614. Born Doménikos Theotokópoulos in Crete. Settled in Toledo from 1577. Distinctive elongated figures and dramatic colour — centuries ahead of his time; only properly rediscovered around 1900.,Spain,Italy,France,Portugal,A,,2,global,stable,2026-04-23,
sports-051,sports,How many players does a rugby union team field?,15,15 players (rugby league uses 13). Rugby union split from association football in 1863 and from rugby league in 1895.,13,16,14,15,D,,2,global,stable,2026-04-23,
sports-052,sports,How many players does an American football team have on the field per side?,11,"11 on the field per side, but with unlimited substitutions and entirely separate offensive and defensive squads — so active roster sizes are around 53 players per team.",10,11,9,12,B,,2,global,stable,2026-04-23,
sports-053,sports,How many players are on a baseball team's fielding lineup?,9,"9 fielders: pitcher, catcher, 1B, 2B, 3B, SS, LF, CF, RF. Hitting lineup is also 9, with designated hitter rules varying by league.",10,8,9,11,C,,2,global,stable,2026-04-23,
sports-054,sports,How many skaters (including the goalie) does each ice hockey team have on the ice?,6,6 including the goaltender. Teams also field a player short during power plays (the penalty-box penalty is what makes hockey strategy distinctive).,6,8,7,5,A,,2,global,stable,2026-04-23,
sports-055,sports,What is the highest possible score in a single three-dart throw in darts?,180 (three triple 20s),180 is the maximum in a single three-dart throw — three triple 20s. Professional darts scoring starts at 501 and counts down; a '9-dart finish' is the sport's equivalent of a perfect game.,200,150,170,180,D,,2,global,stable,2026-04-23,
sports-056,sports,What is the maximum break in a single frame of snooker?,147,"147 is achieved by potting all 15 reds with blacks (15 × 8 = 120), then all six colours in sequence (2+3+4+5+6+7 = 27). Ronnie O'Sullivan holds the record for most competitive 147s (15+).",140,155,150,147,D,,2,global,stable,2026-04-23,
sports-057,sports,"Who won the 2024 World Chess Championship, becoming the youngest world champion at 18?","Gukesh Dommaraju (India), defeating defending champion Ding Liren","Gukesh became the youngest undisputed world champion at 18, breaking Garry Kasparov's 1985 record (22). Defeated defending champion Ding Liren in Singapore.",Ian Nepomniachtchi,Gukesh Dommaraju,Magnus Carlsen,Ding Liren,B,,2,global,periodic,2026-04-23,
sports-058,sports,In which year was the first Formula 1 World Championship race held?,"1950 (at Silverstone, British GP)","First F1 World Championship race: Silverstone, 13 May 1950. Won by Giuseppe Farina (Alfa Romeo). Juan Manuel Fangio won five titles in the 1950s — a record unbroken until Schumacher.",1945,1948,1955,1950,D,,2,global,stable,2026-04-23,
sports-059,sports,"What is the Olympic motto (since 2021, in its expanded form)?","""Citius, Altius, Fortius — Communiter"" (""Faster, Higher, Stronger — Together"")",Added 'Communiter' ('Together') in 2021 at the Tokyo Games. Original motto was coined by Father Henri Didon in 1891 and adopted by Coubertin.,"Citius, Altius, Fortius","Faster, Higher, Stronger — Forever","Citius, Altius, Fortius — Ad Astra","Citius, Altius, Fortius — Communiter",D,,2,global,stable,2026-04-23,
sports-060,sports,In which Swiss city is FIFA headquartered?,Zurich,FIFA has been based in Zurich since its founding in 1904. Headquartered at the 'Home of FIFA' building since 2007. Regularly criticised for opaque governance.,Bern,Zurich,Basel,Geneva,B,,2,global,stable,2026-04-23,
sports-061,sports,In which Swiss city is the International Olympic Committee headquartered?,Lausanne,IOC based in Lausanne since 1915 (moved from Paris during WWI). The 'Olympic Capital' hosts the Olympic Museum and dozens of international sport federations.,Zurich,Lausanne,Geneva,Bern,B,,2,global,stable,2026-04-23,
sports-062,sports,Which team won the first European Cup (now Champions League) in 1956?,Real Madrid,"13 May 1956, Paris. Real Madrid beat Stade de Reims 4–3. Real then won the first five editions (1956–60) — still a record.",AC Milan,Real Madrid,Benfica,FC Barcelona,B,,2,global,stable,2026-04-23,
sports-063,sports,Who holds the record for most Super Bowl wins as a quarterback?,Tom Brady (7),"7 Super Bowl wins — 6 with the New England Patriots, 1 with the Tampa Bay Buccaneers (2021). Retired 2023 at age 45.",Joe Montana,Tom Brady,Terry Bradshaw,Patrick Mahomes,B,,2,global,annual,2026-04-23,
sports-064,sports,What is Wayne Gretzky's famous nickname in ice hockey?,"""The Great One""","Born 1961 in Brantford, Ontario. Holds or shares 61 NHL records. Most points in NHL history (2,857) by a wide margin.","""The Wizard""","""The Magician""","""The Golden Boy""","""The Great One""",D,,2,global,stable,2026-04-23,
sports-065,sports,"Who holds the women's record for Grand Slam singles titles, with 24?","Margaret Court (Australia, 1960–1973)","Australian. Won 24 Grand Slams between 1960 and 1973, including the Calendar Grand Slam in 1970. Serena Williams retired with 23.",Margaret Court,Steffi Graf,Serena Williams,Chris Evert,A,,2,global,periodic,2026-04-23,
sports-066,sports,Who holds the men's pole vault world record as of March 2026?,"Armand ""Mondo"" Duplantis (Sweden) — 6.31m, set in Uppsala in March 2026","Set 6.31m in Uppsala, Sweden, in March 2026 — Duplantis's 14th world record. He has dominated men's pole vault since 2020 and is already considered the greatest ever.","Armand ""Mondo"" Duplantis (6.31m)",Renaud Lavillenie (6.16m),Christopher Nilsen (6.00m),Sergey Bubka (6.14m),A,,2,global,current,2026-04-23,
sports-067,sports,"Who became the NBA's all-time leading scorer in February 2023, passing Kareem Abdul-Jabbar?",LeBron James,"Passed Kareem's 38,387 points on 7 February 2023. Still extending the record as of 2026 with the Lakers.",Karl Malone,LeBron James,Michael Jordan,Kevin Durant,B,,2,global,stable,2026-04-23,
sports-068,sports,What does the IOC stand for?,International Olympic Committee,Founded 1894 by Pierre de Coubertin. 206 National Olympic Committees are members. Selects Olympic host cities years in advance.,International Olympic Council,International Olympics Conference,International Olympic Committee,International Olympic Commission,C,,2,global,stable,2026-04-23,
sports-069,sports,"Which two players contested the famous 1973 ""Battle of the Sexes"" tennis match?",Billie Jean King and Bobby Riggs (King won),"20 September 1973 at the Houston Astrodome. King, 29, beat Riggs, 55, in straight sets. Watched by ~90 million worldwide. A milestone for women's sport.",Martina Navratilova and John McEnroe,Chris Evert and Jimmy Connors,Billie Jean King and Bobby Riggs,Billie Jean King and Jimmy Connors,C,,2,global,stable,2026-04-23,
sports-070,sports,"Which Dutch speed skater won the Olympic 5000m at three consecutive Winter Games (2010, 2014, 2018)?",Sven Kramer,"Won 5000m gold at Vancouver 2010, Sochi 2014 and PyeongChang 2018. Only skater ever to defend the 5000m title three times consecutively.",Sven Kramer,Ids Postma,Erben Wennemars,Gianni Romme,A,,2,netherlands,stable,2026-04-23,
sports-071,sports,"Why is the Dutch national football team known as ""Oranje""?","After the House of Orange-Nassau, the royal family of the Netherlands",Named for the House of Orange-Nassau — the Dutch royal family descended from William of Orange. Dutch national teams wear orange across most sports despite the country's flag being red/white/blue.,After the House of Orange-Nassau,The Orange Revolution of 1672,The orange in the Dutch flag,The Dutch colonial orange trade,A,,2,netherlands,stable,2026-04-23,
sports-072,sports,"Who has won the most men's Ballon d'Or awards, with 8?",Lionel Messi (as of 2023; the 2024 and 2025 awards went to Rodri and Dembélé),"8 Ballons d'Or: 2009, 2010, 2011, 2012, 2015, 2019, 2021, 2023. Ronaldo has 5 — until recently a fierce rivalry that defined an era.",Zinedine Zidane (3),Michel Platini (3),Cristiano Ronaldo (5),Lionel Messi (8),D,,2,global,annual,2026-04-23,
sports-073,sports,"Who set the men's mile world record of 3:43.13 in 1999, a mark still standing?",Hicham El Guerrouj (Morocco),"Set at Rome's Golden Gala, 7 July 1999. Still stands as of 2026 — one of athletics' longest-standing records. El Guerrouj also held the 1500m record until 2024.",Noah Ngeny,Hicham El Guerrouj,Steve Cram,Bernard Lagat,B,,2,global,periodic,2026-04-23,
sports-074,sports,Which Dutch figure skater won Olympic gold at Innsbruck in 1964?,Sjoukje Dijkstra,Gold in women's figure skating at Innsbruck 1964 — the Netherlands' first-ever Winter Olympic gold outside speed skating. Still a rare success for the country in figure skating.,Ranomi Kromowidjojo,Yvonne van Gennip,Sjoukje Dijkstra,Marianne Vos,C,,2,netherlands,stable,2026-04-23,
sports-075,sports,How many players are on a field hockey team (on the field at once)?,11 (the Netherlands is historically one of the dominant nations in the sport),11 on field plus substitutes. The Dutch men's and women's teams have been dominant — the women have won 9 World Cups and are historically the top-ranked side.,9,11,12,10,B,,2,netherlands,stable,2026-04-23,
language-051,language,What is the currency of Australia?,The Australian dollar,"AUD. Introduced 1966, replacing the Australian pound at a 2:1 ratio. Polymer banknotes since 1988 — Australia pioneered them worldwide.",The Commonwealth dollar,The Kiwi dollar,The Australian dollar,The Australian pound,C,,2,global,stable,2026-04-23,
language-052,language,What is the currency of China?,The yuan (renminbi),Officially 'renminbi' ('people's currency'); the 'yuan' is the main unit. Currency code CNY. Tightly managed by the People's Bank of China.,The yuan (renminbi),The won,The yen,The kip,A,,2,global,stable,2026-04-23,
language-053,language,What is the currency of Russia?,The ruble,RUB. 1 ruble = 100 kopeks. Ruble sign (₽) officially introduced in 2013. Heavily devalued after 2022 Western sanctions.,The real,The rupee,The ruble,The złoty,C,,2,global,stable,2026-04-23,
language-054,language,What is the currency of Israel?,"The shekel (new Israeli shekel, ILS)","ILS. Introduced 1985, replacing the hyperinflationary old shekel at 1,000:1. The word 'shekel' dates to antiquity — originally a unit of weight for silver.",The riyal,The shekel,The dinar,The lira,B,,2,global,stable,2026-04-23,
language-055,language,What is the currency of Saudi Arabia?,The riyal,SAR. Pegged to the US dollar since 1986 at a fixed rate of ~3.75 riyals per dollar. Reflects Saudi oil revenues being priced in dollars.,The dinar,The riyal,The dirham,The rial,B,,2,global,stable,2026-04-23,
language-056,language,What is the official language of Egypt?,Arabic,Modern Standard Arabic for official use; Egyptian Arabic is the spoken dialect — the most widely understood Arabic variety thanks to Egyptian cinema and TV.,Coptic,Persian,Egyptian,Arabic,D,,2,global,stable,2026-04-23,
language-057,language,What is the official language of Greece?,Greek,"Modern Greek. Direct descendant of ancient Greek, albeit significantly evolved. Uses the Greek alphabet — one of the oldest still in use (c. 800 BCE).",Albanian,Turkish,Greek,Macedonian,C,,2,global,stable,2026-04-23,
language-058,language,What is the official language of Iran?,Persian (Farsi),"Persian (Farsi). Indo-European language, same family as English — despite using Arabic script. Also spoken as Dari in Afghanistan and Tajik in Tajikistan.",Arabic,Pashto,Urdu,Persian (Farsi),D,,2,global,stable,2026-04-23,
language-059,language,How many letters are in the modern English alphabet?,26,"26 letters. Old English had additional letters (þ thorn, ð eth, æ ash, ƿ wynn) that dropped out of use in the medieval period.",28,24,26,27,C,,2,global,stable,2026-04-23,
language-060,language,How many letters are in the Spanish alphabet (as officially used)?,27 (including ñ),27 letters since the Real Academia Española removed 'ch' and 'll' as separate letters in 2010. Only ñ remains uniquely Spanish.,29,26,28,27,D,,2,global,stable,2026-04-23,
language-061,language,What does HTTP stand for?,Hypertext Transfer Protocol,Developed by Tim Berners-Lee and Roy Fielding in the early 1990s. HTTPS (secure version) added TLS encryption. Underlies every standard web transaction.,HyperText Transport Process,Host-to-Terminal Protocol,Hypertext Transfer Protocol,HyperLink Transfer Protocol,C,,2,global,stable,2026-04-23,
language-062,language,What does HTML stand for?,HyperText Markup Language,The standard markup language for web pages. Created by Berners-Lee at CERN in 1990. Current version HTML5 (2014).,HyperText Markup Language,HyperLink Text Module,HyperText Mapping Language,HyperText Machine Language,A,,2,global,stable,2026-04-23,
language-063,language,What does URL stand for?,Uniform Resource Locator,Coined by Tim Berners-Lee in the early 1990s. Standardised in RFC 1738 (1994). The structure 'protocol://host/path' is now universal.,Universal Resource Locator,Uniform Reference Line,Uniform Routing Link,Uniform Resource Locator,D,,2,global,stable,2026-04-23,
language-064,language,What do the initials BBC stand for?,British Broadcasting Corporation,Founded 1922 by Royal Charter. World's oldest national broadcaster. Funded by the UK TV licence fee. Its World Service broadcasts in over 40 languages.,Britain Broadcasting Company,British Broadcasting Corporation,British Broadcasting Committee,British Business Channel,B,,2,global,stable,2026-04-23,
language-065,language,What do the initials IBM stand for?,International Business Machines,"Founded 1911. Ubiquitous from mainframes (1960s) to the personal computer era (IBM PC, 1981). 'Nobody ever got fired for buying IBM' was a mid-20th-century business adage.",International Binary Machines,Integrated Business Machines,International Business Machines,International Broadcasting Machine,C,,2,global,stable,2026-04-23,
language-066,language,What is a group of elephants called?,A herd (or parade),A herd is also called a 'parade' or 'memory' (from the idea that elephants remember). Elephant family groups are matriarchal — led by the oldest female.,A stampede,A crash,A herd (or parade),A flock,C,,2,global,stable,2026-04-23,
language-067,language,What is a large group of bees in flight called?,A swarm (a stationary colony is a hive),A swarm is in flight; the stationary colony is a hive. Honeybees swarm when the colony divides — the queen leaves with about half the workers.,A bundle,A colony,A hive,A swarm,D,,2,global,stable,2026-04-23,
language-068,language,What is a group of sheep called?,A flock,Sheep in particular don't tend to get special collective nouns in common usage — just 'flock'. A group of lambs is sometimes called a 'fold'.,A drove,A flock,A pack,A herd,B,,2,global,stable,2026-04-23,
language-069,language,What is the fear of the number 13 called?,Triskaidekaphobia,From Greek 'tris' (three) + 'kai' (and) + 'deka' (ten). 'Paraskevidekatriaphobia' is specifically the fear of Friday the 13th.,Trishaphobia,Dekatriphobia,Triskaidekaphobia,Tridekaphobia,C,,2,global,stable,2026-04-23,
language-070,language,"What does the French phrase ""déjà vu"" literally mean?","""Already seen""","Literally 'already seen' in French. The feeling of having previously experienced the current moment. Common and usually harmless, but can be a symptom of temporal-lobe epilepsy.","""Already seen""","""Seen before""","""Already here""","""Back again""",A,,2,global,stable,2026-04-23,
